{"run":58,"commit":"0c76d33","metric":353.5577450363009,"metrics":{},"status":"discard","description":"Tried delaying exact-list visited-set insertion until the first child that actually needs recursive descent, while also inlining scalar/float handling for scalar-only lists, but the aggregate bt_json benchmark regressed versus the current best.","timestamp":1774412040522,"segment":0,"confidence":5.854573144267451}
{"run":59,"commit":"78d9836","metric":350.21564039386595,"metrics":{},"status":"keep","description":"Switch visited-set cleanup from discard() to remove() in bt_safe_deep_copy branches where membership is guaranteed, trimming a bit of defensive overhead from the hot exact-container and fallback container teardown paths.","timestamp":1774412370397,"segment":0,"confidence":5.772158427601105}
{"run":60,"commit":"78d9836","metric":352.7949322872183,"metrics":{},"status":"discard","description":"Confirmation rerun of the remove()-based visited cleanup landed back in the broader ~350–353µs band; keeping the earlier winning commit but discarding this no-code rerun.","timestamp":1774412665469,"segment":0,"confidence":6.007681030664957}
{"run":61,"commit":"78d9836","metric":351.2608287342308,"metrics":{},"status":"discard","description":"Tried moving the model_json_schema class-path check below model_dump/dict probing so ordinary model instances skip an unused isinstance(v, type) branch earlier, but the aggregate bt_json benchmark still regressed slightly versus the current best.","timestamp":1774412996598,"segment":0,"confidence":6.760308249815194}
{"run":62,"commit":"78d9836","metric":351.7327037242361,"metrics":{},"status":"discard","description":"Retried dropping callable() checks for model_dump/dict in _to_bt_safe after the newer bt_json fast-path changes, but the aggregate benchmark still regressed slightly versus the current best.","timestamp":1774413211117,"segment":0,"confidence":7.030527888911275}
{"run":63,"commit":"aaadddc","metric":349.94741905749265,"metrics":{},"status":"keep","description":"Add an early isinstance(v, str) fast path in _to_bt_safe ahead of dataclass/model probing so common string subclasses (like enum-style span attributes) bypass the richer object-detection work without affecting exact scalar or model/dataclass handling.","timestamp":1774413440515,"segment":0,"confidence":6.797575875854772}
{"run":64,"commit":"aaadddc","metric":352.7529096491738,"metrics":{},"status":"discard","description":"Confirmation rerun of the early string-subclass fast path landed back in the broader ~350–353µs range, validating the kept improvement without introducing any further code change.","timestamp":1774413591455,"segment":0,"confidence":6.378025269822195}
{"run":65,"commit":"78d9836","metric":353.22677356757947,"metrics":{},"status":"discard","description":"Tried narrowing the post-model fallback scalar subclass check in _to_bt_safe from (str,bool,int) to only (bool,int) because string subclasses now have their own earlier fast path, but the aggregate benchmark regressed.","timestamp":1774413822761,"segment":0,"confidence":6.373255066406103}
{"run":66,"commit":"ea3166e","metric":344.83290970465237,"metrics":{},"status":"keep","description":"Inline exact scalar and finite-float handling for non-dict elements inside the exact-list fast path so scalar/string list items avoid a full _deep_copy_object redispatch while the dominant list-of-dicts path stays unchanged.","timestamp":1774413992248,"segment":0,"confidence":6.481500984428061}
{"run":67,"commit":"ea3166e","metric":346.82634252922696,"metrics":{},"status":"discard","description":"Confirmation rerun of the exact-list scalar-inline optimization stayed in the improved mid-340µs range, validating the latest kept change without introducing any further code change.","timestamp":1774414140888,"segment":0,"confidence":6.668582696264335}
{"run":68,"commit":"8ccb4a2","metric":348.1037284222322,"metrics":{},"status":"keep","description":"Compute type(value) once per exact-list element and reuse it for the dict/scalar/float branches, avoiding a redundant type() call on every non-dict list item while preserving the optimized list-of-dicts fast path.","timestamp":1774414601782,"segment":0,"confidence":6.779287305242741}
{"run":69,"commit":"8ccb4a2","metric":348.56693704142793,"metrics":{},"status":"discard","description":"Confirmation rerun of the exact-list cached value_type optimization stayed in the improved high-340µs range, validating the kept change without introducing any further code change.","timestamp":1774414759894,"segment":0,"confidence":6.893811077233381}
{"run":70,"commit":"faab97c","metric":335.9028560562187,"metrics":{},"status":"keep","description":"Split the exact-dict and list-of-dicts teardown into a true two-phase path: scalar-only prefixes now return without paying a try/finally cleanup frame, and visited removal is only wrapped around the branch that actually recurses after the first non-scalar child.","timestamp":1774415380027,"segment":0,"confidence":6.734777207115278}
{"run":71,"commit":"faab97c","metric":337.0230954503598,"metrics":{},"status":"discard","description":"Confirmation rerun of the two-phase exact-dict/list-of-dicts teardown stayed in the improved mid-330µs range, validating the kept change without introducing any further code change.","timestamp":1774415529071,"segment":0,"confidence":6.754384181666804}
{"run":72,"commit":"2f5b82f","metric":338.7206501108379,"metrics":{},"status":"keep","description":"Apply the same two-phase visited-set teardown to exact lists: delay adding the list itself to the visited set until the first child that actually needs recursive descent, so scalar-only and scalar-prefix lists skip unconditional add/remove overhead.","timestamp":1774415752252,"segment":0,"confidence":6.753179633861559}
{"run":73,"commit":"2f5b82f","metric":345.6859002454439,"metrics":{},"status":"discard","description":"Confirmation rerun of the delayed exact-list visited-set insertion came back in the broader high-330s to mid-340s band; keeping the earlier winning commit and discarding this no-code rerun.","timestamp":1774415901564,"segment":0,"confidence":6.751975515607452}
{"run":74,"commit":"2f5b82f","metric":344.11972941192465,"metrics":{},"status":"discard","description":"Tried flipping the exact-dict and list-of-dicts key branches to make exact string keys the direct hot path after the newer two-phase teardown changes, but the aggregate bt_json benchmark still regressed versus the current best.","timestamp":1774416211345,"segment":0,"confidence":7.068002136010104}
{"run":75,"commit":"2f5b82f","metric":353.6480895464782,"metrics":{},"status":"discard","description":"Tried delaying exact-list id(v) computation itself until the first recursive child, but the aggregate bt_json benchmark regressed versus the current best despite the small list-focused microbenchmark win.","timestamp":1774416473298,"segment":0,"confidence":7.32467427129712}
{"run":76,"commit":"2f5b82f","metric":338.78047035625866,"metrics":{},"status":"discard","description":"Tried hoisting the exact-list next_depth>=max_depth handling out of the per-dict-element loop after the newer two-phase list teardown changes, but the aggregate bt_json benchmark was effectively flat/slightly worse than the current best.","timestamp":1774416755085,"segment":0,"confidence":7.221996087612733}
{"run":77,"commit":"2f5b82f","metric":341.49193656110333,"metrics":{},"status":"discard","description":"Tried splitting the exact-list fast path into a dedicated first-item-is-dict branch after the newer two-phase list teardown changes, but the aggregate bt_json benchmark still regressed versus the current best despite passing tests.","timestamp":1774417194985,"segment":0,"confidence":7.122156818459104}
{"run":78,"commit":"2f5b82f","metric":342.714444557262,"metrics":{},"status":"discard","description":"Tried flipping the exact-dict and list-of-dicts key branches to make exact string keys the direct hot path after the latest list two-phase cleanup, but the aggregate bt_json benchmark still regressed.","timestamp":1774417614316,"segment":0,"confidence":7.200897337584435}
{"run":79,"commit":"2f5b82f","metric":337.812004597463,"metrics":{},"status":"discard","description":"Confirmation rerun of the two-phase exact-list visited-set teardown landed essentially on top of the kept result, reinforcing that the current best bt_json implementation is stable in the high-330µs range without any additional code change.","timestamp":1774417862198,"segment":0,"confidence":7.281398385716894}
